headline,link,premium,subhead,byline,article_type,image
" James Galbraith, economist: 'The Fed is an agency created by Congress, controlled by it, and accountable to it'  ",https://www.lemonde.fr/en/economy/article/2026/02/05/james-galbraith-economist-the-fed-is-an-agency-created-by-congress-controlled-by-it-and-accountable-to-it_6750164_19.html,Subscribers only,"The US inflation decline did not result from action by the Federal Reserve and a reduction in interest rates would therefore be justified, said the University of Texas professor in an interview with Le Monde. However, in his view, Trump should've let the Republican majority in both chambers of Congress pressure the central bank.",,,https://img.lemde.fr/2026/01/22/957/0/2858/1905/400/266/75/0/96ab85b_upload-1-wltzez8gvg1r-james-galbraith.jpg
Ukraine says Abu Dhabi talks with Russia 'substantive and productive',https://www.lemonde.fr/en/international/article/2026/02/04/ukraine-says-abu-dhabi-talks-with-russia-substantive-and-productive_6750155_4.html,,,,,https://img.lemde.fr/2026/02/04/0/40/1119/746/398/265/75/0/99a793a_ftp-1-r0poojvx3lwn-2026-02-04t152920z-2018822131-rc22fjamt7oi-rtrmadp-3-ukraine-crisis-russia-emirates-talks.JPG
Last US-Russia nuclear treaty ends in 'grave moment' for world,https://www.lemonde.fr/en/international/article/2026/02/05/last-us-russia-nuclear-treaty-ends-in-grave-moment-for-world_6750158_4.html,,,,,https://img.lemde.fr/2026/01/29/0/469/5062/3375/398/265/75/0/f8fd7fd_ftp-1-veol66vxm8bo-2026-01-29t182421z-1296989132-rc25bjambmwq-rtrmadp-3-un-guterres.JPG
Democracy is fading in Africa as the world looks away,https://www.lemonde.fr/en/opinion/article/2026/02/05/democracy-is-fading-in-africa-as-the-world-looks-away_6750165_23.html,Subscribers only,"While global powers covet Africa's natural resources, they have paid little attention to the wave of coups that have swept the continent in recent years.",,,https://img.lemde.fr/2025/12/23/1/0/8192/5461/398/265/75/0/c8a3407_ftp-1-szxhyryvsd5v-454b806dadab4f3298b82860aba1c578-0-f361f9cc06fe4fc19ba57879d04fddda.jpg
"'The Mastermind,' by filmmaker Kelly Reichardt: The art of losing oneself",https://www.lemonde.fr/en/culture/article/2026/02/05/the-mastermind-by-filmmaker-kelly-reichardt-the-art-of-losing-oneself_6750163_30.html,Subscribers only,"In telling the story of an art heist gone awry, the director paints a somber and disillusioned portrait of the 1970s.",,,https://img.lemde.fr/2026/02/04/0/300/3240/2160/398/265/75/0/634a2a7_upload-1-kltgtr5tvtf4-7-the-mastermind-still-04-2025-mastermind-movie-inc.jpg
The traditional blouse immortalized by Matisse becomes a political symbol in Romania,https://www.lemonde.fr/en/international/article/2026/02/05/the-traditional-blouse-immortalized-by-matisse-becomes-a-political-symbol-in-romania_6750162_4.html,Subscribers only,"The far right has turned this blouse with flared sleeves and colorful embroidery into a nationalist emblem. Once again a source of cultural pride after the 1989 revolution in Romania, it now finds itself at the heart of political appropriation.",,,https://img.lemde.fr/2026/02/02/142/0/7584/5056/398/265/75/0/1e8b90f_upload-1-wnoeemrn70j5-000-363l3ag.jpg
"Robbie Williams, the nostalgic pop star",https://www.lemonde.fr/en/m-le-mag/article/2026/02/05/robbie-williams-the-nostalgic-pop-star_6750166_117.html,Subscribers only,"For more than 30 years, the British singer has ridden a wave of global success, releasing hit after hit and filling stadiums. At 51, still in the media spotlight that once burned him, the former boy band member remains a tireless entertainer. Now on a mega tour across Europe, he has just released his 13th album, a nod to the vibrant 1990s Britpop scene that always snubbed him.", Clément Ghys,Profile,https://img.lemde.fr/2026/01/21/1847/0/6610/4406/664/442/75/0/1ca321a_upload-1-tspsubru9mmn-749-williams-lebon-002.jpg
NBC 'Today' host Savannah Guthrie pleads with her mother's alleged kidnapper: 'We are ready to talk',https://www.lemonde.fr/en/international/article/2026/02/05/nbc-today-host-savannah-guthrie-pleads-to-her-mother-s-alleged-kidnapper-we-are-ready-to-talk_6750161_4.html,,,,,https://img.lemde.fr/2026/02/03/0/150/1620/1080/198/132/95/0/5d7c3d6_ftp-1-ivfxnthhxqhx-2026-02-03t221748z-635199568-rc2gejat5gaq-rtrmadp-3-usa-crime-guthrie.JPG
Relations between South Africa and Israel hit new low amid fears of US reprisals,https://www.lemonde.fr/en/le-monde-africa/article/2026/02/05/relations-between-south-africa-and-israel-hit-new-low-amid-fears-of-us-reprisals_6750159_124.html,Subscribers only,,,,https://img.lemde.fr/2026/02/01/0/0/3174/2116/198/132/95/0/17234ab_upload-1-ibsnlj7qrqqe-000-36ya7xc.jpg
"French far right's EU embezzlement was 'directed by' Le Pen, prosecutors argue",https://www.lemonde.fr/en/politics/article/2026/02/04/le-pen-s-appeal-trial-prosecution-argues-embezzlement-was-directed-by-the-party-head_6750147_5.html,Subscribers only,,,,https://img.lemde.fr/2026/02/03/360/208/3545/2363/198/132/95/0/0296e64_upload-1-1rgowm1tswnx-aquindo-procesrn-03fev-marinelepen.jpg
European intelligence services adapt to the upheavals of the Trump era,https://www.lemonde.fr/en/international/article/2026/02/04/european-intelligence-services-adapt-to-the-upheavals-of-the-trump-era_6750150_4.html,Subscribers only,,,,https://img.lemde.fr/2026/01/07/333/0/5000/3333/198/132/95/0/81adcd7_upload-1-x0ldwoh5ddft-kzihnioglu-paris-elysee-coalition-volontaires-06012026-hd-119.JPG
France's North Atlantic overseas territory sees 'no clear sense of worry' over Trump among residents,https://www.lemonde.fr/en/politics/article/2026/02/05/in-france-s-north-atlantic-overseas-territory-no-clear-sense-of-worry-among-residents-over-trump_6750160_5.html,Subscribers only,,,,
French Navy seizes over 4 metric tons of cocaine in the South Pacific,https://www.lemonde.fr/en/global-issues/article/2026/02/05/french-navy-seizes-over-4-metric-tons-of-cocaine-in-the-south-pacific_6750167_199.html,,,,,
Michael Jackson film reveals previously unheard clips of thoughts on children,https://www.lemonde.fr/en/international/article/2026/02/04/michael-jackson-film-reveals-previously-unheard-clips-of-thoughts-on-children_6750153_4.html,,,,,
Foreign language learning holds strong against the AI wave,https://www.lemonde.fr/en/employment/article/2026/02/05/foreign-language-learning-holds-strong-against-the-ai-wave_6750168_103.html,Subscribers only,,,,
Man sentenced to life in prison for plotting to kill Trump in 2024,https://www.lemonde.fr/en/international/article/2026/02/04/man-sentenced-to-life-in-prison-for-plotting-to-kill-trump-in-2024_6750154_4.html,,,,,
"In Gaza, the fate of thousands missing remains unknown",https://www.lemonde.fr/en/international/article/2026/02/04/in-gaza-the-fate-of-thousands-missing-remains-unknown_6750131_4.html,Subscribers only,,,,
Trump's new border chief removes 700 immigration officers from Minnesota,https://www.lemonde.fr/en/international/article/2026/02/04/trump-s-new-border-chief-removes-700-immigration-officers-from-minnesota_6750146_4.html,,,,,
"'To revive a strong integration policy, it must become a government priority, separate from the issue of immigration'",https://www.lemonde.fr/en/opinion/article/2026/02/05/to-revive-a-strong-integration-policy-it-must-become-a-government-priority-separate-from-the-issue-of-immigration_6750156_23.html,Subscribers only,,,,
Ukraine's 'grandfathers' go to war,https://www.lemonde.fr/en/international/article/2026/02/04/ukraine-s-grandfathers-go-to-war_6750151_4.html,Subscribers only,"The Ukrainian army has an average age of 45, significantly older than European standards. The draft has targeted men between the ages of 25 and 60, which contrasts with recruitment practices typically seen in Western countries.", Florence Aubenas,Feature,https://img.lemde.fr/2026/01/12/1/0/4000/2666/664/442/75/0/891e9d7_upload-1-xyxs2ebmi3wd-reportage-vieux-soldats-13.jpg
2026 Winter Olympics: Artificial snow takes a toll on the environment,https://www.lemonde.fr/en/sports/article/2026/02/04/2026-winter-olympics-artificial-snow-takes-a-toll-on-the-environment_6750118_9.html,Subscribers only,"The Milan Cortina Olympic Games are no exception: Artificial snowmaking will be used almost everywhere. This technology, which requires large amounts of water and energy, has led to major infrastructure changes that have been criticized by environmental advocates and scientists.", Maryline Baumard,Feature,https://img.lemde.fr/2026/02/02/0/0/8256/5504/664/442/75/0/ae5c9b8_upload-1-jyneybmdcw7s-020-2253612571.jpg
French Sénat condemned for silence over ex-senator found guilty of drugging MP,https://www.lemonde.fr/en/politics/article/2026/02/04/french-senat-condemned-for-silence-over-ex-senator-found-guilty-of-drugging-mp_6750138_5.html,Subscribers only,"Publicly questioned by the victim, MP Sandrine Josso, Sénat President Gérard Larcher has, for the first time, expressed his public support for her.", Robin Richardot,In Depth,https://img.lemde.fr/2026/01/26/0/0/5499/3666/664/442/75/0/f10d46f_ftp-1-mqtyg6qkdmhh-2026-01-26t123633z-1894783545-rc209jaosn1a-rtrmadp-3-france-justice.JPG
The end of US-Russia nuclear treaty is a dangerous signal for deterrance,https://www.lemonde.fr/en/opinion/article/2026/02/04/the-end-of-us-russia-nuclear-treaty-is-a-dangerous-signal-for-deterrance_6750134_23.html,,,,Editorial,
"'Trump put liberal democracy in the crosshairs in 2025, he might pull the trigger in 2026'",https://www.lemonde.fr/en/opinion/article/2026/02/05/trump-put-liberal-democracy-in-the-crosshairs-in-2025-he-might-pull-the-trigger-in-2026_6750157_23.html,Subscribe,,,Op-Ed,
'The race toward the geopolitical grotesque must be taken very seriously',https://www.lemonde.fr/en/opinion/article/2026/02/04/the-race-toward-the-geopolitical-grotesque-must-be-taken-very-seriously_6750142_23.html,Subscribe,,,Op-Ed,
