headline,link,premium,subhead,byline,article_type,image
" EU-Mercosur deal: Brazil, the agricultural superpower that feeds the world  ",https://www.lemonde.fr/en/economy/article/2026/01/12/eu-mercosur-deal-brazil-the-agricultural-superpower-that-feeds-the-world_6749313_19.html,Subscribers only,"Agriculture accounts for nearly a quarter of Brazil's GDP and employs one in five Brazilians. These figures began their rise 40 years ago, largely based on the development of GMOs and the transformation of the country's soils.",,,https://img.lemde.fr/2026/01/10/56/0/4734/3156/400/266/75/0/95d93fb_upload-1-rkzr0idecogs-000-97l9zp.jpg
Powell says Federal Reserve subpoenaed by Trump Justice Department,https://www.lemonde.fr/en/international/article/2026/01/12/powell-says-federal-reserve-subpoenaed-by-trump-justice-department_6749310_4.html,,,,,https://img.lemde.fr/2026/01/12/0/0/5616/3744/398/265/75/0/a0268c8_ftp-1-c7nrf2razzct-2026-01-12t013733z-1576897754-rc28tfai09my-rtrmadp-3-usa-fed-powell.JPG
"2026 Golden Globes: 'One Battle After Another' sweeps Best Film, Best Director and Best Screenplay",https://www.lemonde.fr/en/culture/article/2026/01/12/2026-golden-globes-rose-byrne-wins-golden-globe-for-best-female-actor-in-a-motion-picture-comedy_6749311_30.html,,,,,https://img.lemde.fr/2026/01/12/2/0/7777/5184/398/265/75/0/baba40f_ftp-1-bnz5luhjna0h-5862653-01-06.jpg
Far right continues to gain ground in French public opinion,https://www.lemonde.fr/en/france/article/2026/01/11/far-right-continues-to-gain-ground-in-french-public-opinion_6749302_7.html,Subscribers only,"France is divided, with half the population anxious about the rise of the Rassemblement National, and half enthusiastic about the solutions it claims to offer, according to an annual survey conducted by the Verian institute for Le Monde.",,,https://img.lemde.fr/2025/12/01/0/0/5189/3459/398/265/75/0/72fc801_ftp-1-w1014s0w3apo-2025-12-01t155248z-1780517177-rc2o7ia0ebwj-rtrmadp-3-france-politics.JPG
Trump's brute force will not drive China out of Latin America,https://www.lemonde.fr/en/opinion/article/2026/01/12/trump-s-brute-force-will-not-drive-china-out-of-latin-america_6749314_23.html,Subscribers only,"Trade has become the main vehicle of Chinese power, and the deep dependencies already created weigh more heavily than the threat of diplomatic, or even military, pressure wielded by the US.",,,https://img.lemde.fr/2025/11/26/0/0/7333/4889/398/265/75/0/e121aa4_ftp-import-images-1-3ihoxjme91yn-5527866-01-06.jpg
Californian billionaires flee potential one-off 5% wealth tax,https://www.lemonde.fr/en/economy/article/2026/01/11/californian-billionaires-flee-potential-one-off-5-wealth-tax_6749306_19.html,Subscribers only,"In 2024, California had 255 billionaires, more than any other state. A state ballot initiative aimed at taxing the state's wealthiest residents could be put to a public vote in autumn 2026.",,,https://img.lemde.fr/2026/01/09/0/0/5472/3648/398/265/75/0/3997a91_upload-1-gnvmcosv6ueb-063-1175129147.jpg
The British seniors trading tea dances at a daring cabaret,https://www.lemonde.fr/en/intimacy/article/2026/01/12/the-united-kingdom-sees-seniors-trade-tea-dances-for-daring-cabaret_6749312_310.html,Subscribers only,"Once a month at London's The Posh Club, burlesque acts and striptease in a nightclub atmosphere delight Brits over 60, who let loose until late in the afternoon.", Julie Zaugg ,Feature,https://img.lemde.fr/2025/12/15/3/0/8220/5480/664/442/75/0/1cd0581_upload-1-9oou4d9rjr5e-laurenfleishman-londonposhclub24.JPG
Jennifer Lopez and Jenna Ortega dazzle on the 2026 Golden Globes red carpet,https://www.lemonde.fr/en/culture/article/2026/01/12/one-battle-after-another-is-a-front-runner-heading-into-golden-globes_6749307_30.html,,,,,https://img.lemde.fr/2026/01/12/0/0/6000/4000/198/132/95/0/64b5d1a_ftp-1-5pslsy7kxw4o-2026-01-12t014028z-418897727-hp1em1c04nehv-rtrmadp-3-awards-golden-globes.JPG
Danish PM says Greenland showdown at 'decisive moment' after new Trump threats,https://www.lemonde.fr/en/international/article/2026/01/10/greenland-s-parties-reject-american-rule-after-latest-trump-threat_6749281_4.html,,,,,https://img.lemde.fr/2026/01/06/0/0/5314/3543/198/132/95/0/2f8c4d5_ftp-1-d16ch7sghuwh-5815381-01-06.jpg
"Trump threatens Cuba, Havana says its people are 'ready to defend the homeland'",https://www.lemonde.fr/en/international/article/2026/01/11/trump-threatens-cuba-havana-says-its-people-are-ready-to-defend-the-homeland_6749304_4.html,,,,,https://img.lemde.fr/2026/01/11/0/0/3350/2233/198/132/95/0/aed77d2_ftp-1-atm2qvgi2osp-2026-01-11t133150z-1311057759-rc2xxian08wn-rtrmadp-3-usa-trump-cuba.JPG
French Alps avalanches kill at least six skiers,https://www.lemonde.fr/en/environment/article/2026/01/12/french-alps-avalanches-kill-at-least-6-skiers_6749309_114.html,,,,,https://img.lemde.fr/2026/01/11/0/0/6000/4000/198/132/95/0/b144423_ftp-1-shn9c18k2hyi-5856606-01-06.jpg
"By crushing its own people, the Iranian regime paves the way for its own downfall",https://www.lemonde.fr/en/opinion/article/2026/01/11/by-crushing-its-own-people-the-iranian-regime-paves-the-way-for-its-own-downfall_6749299_23.html,,,,Editorial,
Trump signs emergency order to protect US-held revenue from Venezuela oil,https://www.lemonde.fr/en/international/article/2026/01/10/trump-signs-emergency-order-to-protect-us-held-revenue-from-venezuela-oil_6749289_4.html,,,,,
"Christophe Vasseur, baker and restaurateur",https://www.lemonde.fr/en/lifestyle/article/2026/01/11/christophe-vasseur-baker-and-restaurateur_6749297_37.html,Subscribers only,,,,
EU-Mercosur deal heralds real but far-off gains for the European industrial sector,https://www.lemonde.fr/en/economy/article/2026/01/11/eu-mercosur-deal-heralds-real-but-far-off-gains-for-the-european-industrial-sector_6749298_19.html,Subscribers only,,,,
Syria's Kurdish fighters agree to leave Aleppo after deadly clashes,https://www.lemonde.fr/en/international/article/2026/01/10/syria-strikes-kurdish-area-of-aleppo-as-fighters-refuse-to-evacuate_6749280_4.html,,,,,
"Moses with a selfie stick, Goliath at a weightlifting competition: How AI gives the sacred new life",https://www.lemonde.fr/en/religions/article/2026/01/11/moses-with-a-selfie-stick-goliath-at-a-weightlifting-competition-how-ai-gives-the-sacred-new-life_6749294_63.html,Subscribers only,,,,
Mexico's president downplays Trump's threats,https://www.lemonde.fr/en/international/article/2026/01/10/mexico-s-president-downplays-trump-s-threats_6749287_4.html,Subscribers only,,,,
EU Commission considers enacting the EU-Mercosur trade deal before MEPs ratify it,https://www.lemonde.fr/en/economy/article/2026/01/10/eu-commission-considers-enacting-the-eu-mercosur-trade-deal-before-meps-ratify-it_6749270_19.html,Subscribers only,,,,
Inside the Paris workshop where hats take shape,https://www.lemonde.fr/en/lifestyle/article/2026/01/11/inside-the-paris-workshop-where-hats-take-shape_6749305_37.html,Subscribers only,"Founded in 1936 in Paris, Maison Michel continues the artisanal tradition of millinery. With the recent in-house addition of the rare skill of formiers, hat block makers, the Chanel-owned brand now oversees every step of production, enabling boundless experimentation. Determined to make hats a modern accessory, Artistic Director Priscilla Royer relishes this newfound freedom.", Sophie Abriat,Feature,https://img.lemde.fr/2025/08/25/348/0/1207/804/664/442/75/0/3fe3e5f_ftp-import-images-1-fxrv07z2l7ex-393688-3435364.jpg
"The Ukrainian-held Donbas, a land of ruins and grief",https://www.lemonde.fr/en/international/article/2026/01/11/the-ukrainian-held-donbas-a-land-of-ruins-and-grief_6749296_4.html,Subscribers only,"This region in eastern Ukraine now has only 200,000 inhabitants, compared to five million before the Russian invasion of 2022. Le Monde visited the area still under Kyiv's authority.", Ariane Chemin and  Guillaume Herbaut,Feature,https://img.lemde.fr/2025/12/26/918/0/6880/4586/664/442/75/0/cf27104_upload-1-7ru5qjrn3a6k-2025-12-10-heg-ukraine-0001.JPG
'Love Is Blind: France' contestants sue over 'inhuman or degrading treatment' during filming,https://www.lemonde.fr/en/france/article/2026/01/09/love-is-blind-france-contestants-sue-over-inhuman-or-degrading-treatment-during-filming_6749265_7.html,Subscribers only,"Three participants in the French version of Netflix reality TV show have brought their case before a Paris-region labor court, claiming they were deprived of their personal freedoms during the filming of the show.", Jérôme Lefilliâtre,In Depth,https://img.lemde.fr/2026/01/08/139/0/12000/8000/664/442/75/0/351a3d0_upload-1-bj16fkaaycs0-4.jpg
France's narrow path toward a budget,https://www.lemonde.fr/en/opinion/article/2026/01/09/france-s-narrow-path-toward-a-budget_6749257_23.html,,,,Editorial,
"'Instead of commenting on the unthinkable, Europeans should take action in Greenland'",https://www.lemonde.fr/en/opinion/article/2026/01/09/instead-of-commenting-on-the-unthinkable-europeans-should-take-action-in-greenland_6749234_23.html,Subscribe,,,Op-Ed,
"'A spirit of reconquest has taken hold in Washington, particularly driven by Secretary of State Marco Rubio'",https://www.lemonde.fr/en/opinion/article/2026/01/06/a-spirit-of-reconquest-has-taken-hold-in-washington-particularly-driven-by-secretary-of-state-marco-rubio_6749152_23.html,Subscribe,,,Op-Ed,
