headline,link,premium,subhead,byline,article_type,image
 Marine Le Pen returns to court for appeal of graft conviction  ,https://www.lemonde.fr/en/politics/article/2026/01/13/marine-le-pen-returns-to-court-for-appeal-of-graft-conviction_6749343_5.html,Subscribers only,"The French far right's leader, sentenced in 2025 to four years in prison and a five-year ban on holding an elected office after being convicted of embezzlement of pubic funds, goes back to court with 11 co-defendants for a one-month trial starting Tuesday.",,,https://img.lemde.fr/2026/01/10/0/0/4399/2932/400/266/75/0/a0a4116_ftp-1-b3uv0akw4hgi-5847237-01-06.jpg
Venezuela's Delcy Rodriguez faces an obstacle-strewn path,https://www.lemonde.fr/en/international/article/2026/01/13/venezuela-s-delcy-rodriguez-faces-an-obstacle-strewn-path_6749340_4.html,Subscribers only,,,,https://img.lemde.fr/2026/01/09/0/0/5500/3666/398/265/75/0/f1ed6dc_ftp-1-7buc10r06i9n-2026-01-09t005744z-641419263-rc2bxiaaawoy-rtrmadp-3-usa-venezuela-victims-tribute.JPG
'The Islamic Republic of Iran is entering its final phase',https://www.lemonde.fr/en/opinion/article/2026/01/13/the-islamic-republic-of-iran-is-entering-its-final-phase_6749342_23.html,Subscribers only,,,,https://img.lemde.fr/2024/04/17/0/0/6000/4000/398/265/75/0/4e6b66a_5218059-01-06.jpg
"Ex-Fed chiefs, lawmakers slam US probe into Jerome Powell",https://www.lemonde.fr/en/international/article/2026/01/12/powell-says-federal-reserve-subpoenaed-by-trump-justice-department_6749310_4.html,,"Powell said the Fed received grand jury subpoenas and threats of a criminal indictment relating to Senate testimony he gave in June. Ex-Fed chiefs Ben Bernanke, Alan Greenspan and Janet Yellen slammed the DOJ's probe, calling it 'an unprecedented attempt to use prosecutorial attacks' to undermine the Fed's independence.",,,https://img.lemde.fr/2025/04/23/29/0/2062/1374/398/265/75/0/eac01bd_sirius-fs-upload-1-p8ntetpzvjpf-1745389768834-676067.jpg
"Paris FC's Ikoné stuns PSG, knocking out former club from French Cup",https://www.lemonde.fr/en/football/article/2026/01/13/paris-fc-s-ikone-stuns-psg-knocks-out-former-club-from-french-cup_6749341_130.html,,Paris FC beat their city rivals 1-0 at Parc des Princes in the French capital on Monday to reach the last 16 of the French Cup. It was Paris Saint-Germain's first loss at home in the competition since 2022 and first last-32 defeat since 2014.,,,https://img.lemde.fr/2026/01/12/0/0/3268/2178/398/265/75/0/03b3bfb_ftp-1-7uksowrdspfp-5867753-01-06.jpg
"In Los Angeles, the specter of lingering pollution after major wildfires",https://www.lemonde.fr/en/environment/article/2026/01/13/in-los-angeles-the-specter-of-lingering-pollution-after-major-wildfires_6749344_114.html,Subscribers only,The fires that occurred a year ago released toxic smoke that seeped into homes that were either untouched or only partially damaged. A French researcher based in California has demonstrated that these fumes contain extremely high levels of dangerous heavy metals.,,,https://img.lemde.fr/2026/01/09/1/0/2999/1999/398/265/75/0/35c186a_upload-1-wkuh95j8vlvp-stellakalinina-losangelesreconstruction-81.jpg
Paris launches project for Montparnasse renovation,https://www.lemonde.fr/en/economy/article/2026/01/13/paris-launches-project-for-montparnasse-renovation_6749346_19.html,Subscribers only,The architect Renzo Piano unveiled his new renovation plan for the shopping center. Construction is hoped to start in 2028., Emeline Cazi,In Depth,https://img.lemde.fr/2026/01/08/78/0/1388/925/664/442/75/0/2e94523_upload-1-kwnzuai54prx-capture-d-e-cran-2026-01-08-a-11-14-40.png
Taiwan announces 'general consensus' with US on trade deal,https://www.lemonde.fr/en/international/article/2026/01/13/taiwan-says-reached-general-consensus-with-us-on-trade-deal_6749348_4.html,,,,,https://img.lemde.fr/2026/01/10/0/0/6769/4513/198/132/95/0/f4dad50_ftp-1-1ecjxjhfzntb-2026-01-10t030331z-1964635537-rc2fxiajq3jy-rtrmadp-3-taiwan-bridge.JPG
Trump announces tariffs on Iran's trading partners as protest toll rises,https://www.lemonde.fr/en/international/article/2026/01/13/iran-protest-toll-mounts-as-government-stages-mass-rallies_6749339_4.html,,,,,https://img.lemde.fr/2026/01/12/0/0/5106/3404/198/132/95/0/db39afa_ftp-1-uux9bjdgopn6-2026-01-12t181028z-54579447-rc2qziau1xpv-rtrmadp-3-iran-economy-protests.JPG
"'What is happening with tariffs sums up Trumpism: Bombastic declarations, laborious implementation and unpredictable results'",https://www.lemonde.fr/en/opinion/article/2026/01/13/what-is-happening-with-tariffs-sums-up-trumpism-bombastic-declarations-laborious-implementation-and-unpredictable-results_6749345_23.html,Subscribers only,,,,https://img.lemde.fr/2026/01/12/0/0/5554/3703/198/132/95/0/89d55f5_ftp-1-sd6dujnzlwc2-2026-01-12t031247z-1367951694-rc2cziak5ll2-rtrmadp-3-usa-trump.JPG
"'Anything can be considered a form of devotion. In my own way, I try to make the world a better place': Romain's conversion to the Bahá'í faith",https://www.lemonde.fr/en/intimacy/article/2026/01/13/anything-can-be-considered-a-form-of-devotion-in-my-own-way-i-try-to-make-the-world-a-better-place-romain-s-conversion-to-the-baha-faith_6749347_310.html,Subscribers only,,,,https://img.lemde.fr/2025/12/22/1563/0/5464/3642/198/132/95/0/fa29d4d_upload-1-c1w9nau4hi1r-romain-foibahai-e-8.jpg
Ex-Corsican nationalist leader and football club president Alain Orsoni shot dead at mother's funeral,https://www.lemonde.fr/en/international/article/2026/01/13/ex-corsican-nationalist-leader-soccer-club-president-alain-orsoni-shot-dead-at-mother-s-funeral_6749349_4.html,,,,,
"NATO, Greenland vow to boost Arctic security after Trump threats",https://www.lemonde.fr/en/international/article/2026/01/12/nato-greenland-vow-to-boost-arctic-security-after-trump-threats_6749338_4.html,,,,,
How France's fixation with decline serves the Trumpian narrative,https://www.lemonde.fr/en/politics/article/2026/01/12/how-france-s-fixation-with-decline-serves-the-trumpian-narrative_6749337_5.html,Subscribers only,,,,
Quinn Slobodian: 'The US discarding the post-1945 international system is a bold and reckless gamble',https://www.lemonde.fr/en/opinion/article/2026/01/12/quinn-slobodian-the-us-discarding-the-post-1945-international-system-is-a-bold-and-reckless-gamble_6749331_23.html,Subscribers only,,,,
"EU-Mercosur deal: Brazil, the agricultural superpower that feeds the world",https://www.lemonde.fr/en/economy/article/2026/01/12/eu-mercosur-deal-brazil-the-agricultural-superpower-that-feeds-the-world_6749313_19.html,Subscribers only,,,,
Trump's brute force will not drive China out of Latin America,https://www.lemonde.fr/en/opinion/article/2026/01/12/trump-s-brute-force-will-not-drive-china-out-of-latin-america_6749314_23.html,Subscribers only,,,,
Cuba's economy and stability are shaken by the Venezuela crisis,https://www.lemonde.fr/en/international/article/2026/01/12/cuba-s-economy-and-stability-are-shaken-by-the-venezuela-crisis_6749320_4.html,Subscribers only,,,,
Morgue near Tehran overwhelmed by bodies amid protest crackdown,https://www.lemonde.fr/en/international/article/2026/01/12/morgue-near-tehran-overwhelmed-by-bodies-amid-protest-crackdown_6749321_4.html,Subscribers only,,,,
The British seniors trading tea dances at a daring cabaret,https://www.lemonde.fr/en/intimacy/article/2026/01/12/the-united-kingdom-sees-seniors-trade-tea-dances-for-daring-cabaret_6749312_310.html,Subscribers only,"Once a month at London's The Posh Club, burlesque acts and striptease in a nightclub atmosphere delight Brits over 60, who let loose until late in the afternoon.", Julie Zaugg ,Feature,https://img.lemde.fr/2025/12/15/3/0/8220/5480/664/442/75/0/1cd0581_upload-1-9oou4d9rjr5e-laurenfleishman-londonposhclub24.JPG
'Don't forget you saved my life': Letter to the stranger who gave me their bone marrow,https://www.lemonde.fr/en/intimacy/article/2026/01/10/don-t-forget-you-saved-my-life-letter-to-the-stranger-who-gave-me-their-bone-marrow_6749288_310.html,Subscribers only,"Hélène Schlesinger was 37 and had a husband, two children, and plenty of plans for the future when she learned, in 2022, that she had leukemia. For months, the young woman fought as she waited for a bone marrow transplant. She lives thanks to an anonymous donor. All she knows is that he is German and that a part of him now lives inside her.", Clara Georges,Long Read,https://img.lemde.fr/2025/12/22/80/0/1493/995/664/442/75/0/3cf9ba3_ftp-1-jcv80jaq2zu7-410919-3431679.jpg
"The Ukrainian-held Donbas, a land of ruins and grief",https://www.lemonde.fr/en/international/article/2026/01/11/the-ukrainian-held-donbas-a-land-of-ruins-and-grief_6749296_4.html,Subscribers only,"This region in eastern Ukraine now has only 200,000 inhabitants, compared to five million before the Russian invasion of 2022. Le Monde visited the area still under Kyiv's authority.", Ariane Chemin and  Guillaume Herbaut,Feature,https://img.lemde.fr/2025/12/26/918/0/6880/4586/664/442/75/0/cf27104_upload-1-7ru5qjrn3a6k-2025-12-10-heg-ukraine-0001.JPG
2027 French presidential election: A real campaign is needed to slow the far right,https://www.lemonde.fr/en/opinion/article/2026/01/12/2027-french-presidential-election-a-real-campaign-is-needed-to-slow-the-far-right_6749319_23.html,,,,Editorial,
"By crushing its own people, the Iranian regime paves the way for its own downfall",https://www.lemonde.fr/en/opinion/article/2026/01/11/by-crushing-its-own-people-the-iranian-regime-paves-the-way-for-its-own-downfall_6749299_23.html,,,,Editorial,
"'Instead of commenting on the unthinkable, Europeans should take action in Greenland'",https://www.lemonde.fr/en/opinion/article/2026/01/09/instead-of-commenting-on-the-unthinkable-europeans-should-take-action-in-greenland_6749234_23.html,Subscribe,,,Op-Ed,
