headline,link,premium,subhead,byline,article_type,image
 Sarkozy and the mystery of the Libyan money: A look back at a legal marathon  ,https://www.lemonde.fr/en/france/article/2026/04/23/sarkozy-and-the-mystery-of-the-libyan-money-a-look-back-at-a-legal-marathon_6752737_7.html,Subscribers only,The appeals trial over suspicions of Libyan funding for the 2007 presidential campaign began on March 16. The case is filled with a cast of shady figures.,,,https://img.lemde.fr/2026/04/21/0/0/2048/1365/400/266/75/0/ad8072c_upload-1-vvxew9fo8fcy-000-par2004060915533.jpg
Iran refuses to open Strait of Hormuz as long as US blockade remains in place,https://www.lemonde.fr/en/international/article/2026/04/23/iran-refuses-to-open-strait-of-hormuz-as-long-as-us-blockade-remains-in-place_6752734_4.html,,,,,https://img.lemde.fr/2026/04/22/0/0/5500/3666/398/265/75/0/2164f5c_ftp-1-iypayt9f8ynm-2026-04-22t102740z-371511109-rc2aukarz0lt-rtrmadp-3-iran-crisis-oman-hormuz.JPG
UK and France agree three-year deal to stop migrant Channel crossings,https://www.lemonde.fr/en/international/article/2026/04/23/uk-and-france-strike-new-channel-migration-deal-with-boosted-enforcement-and-funding_6752732_4.html,,,,,https://img.lemde.fr/2026/01/13/0/0/4468/2979/398/265/75/0/67855bd_ftp-1-1gj2kknvbht3-2026-01-13t144554z-1179364175-rc270hawdp71-rtrmadp-3-migration-britain.JPG
"G7 environment ministers omit climate from talks: 'If we start talking about it, there is no more G7'",https://www.lemonde.fr/en/environment/article/2026/04/23/g7-environment-ministers-omit-climate-from-talks-in-paris-if-we-start-talking-about-it-there-is-no-more-g7_6752743_114.html,Subscribers only,"France, which is hosting the meeting on Thursday and Friday in Paris, has had to make concessions to ensure the participation of the US.",,,https://img.lemde.fr/2026/02/27/0/0/6106/4070/398/265/75/0/f9ff1eb_ftp-1-uvht1m7ibdol-5309265-01-06.jpg
"Boris Pistorius, the man preparing Germany for war",https://www.lemonde.fr/en/international/article/2026/04/23/boris-pistorius-the-man-preparing-germany-for-war_6752733_4.html,Subscribers only,"The country's most popular politician for the past three years, who started serving as defense minister under Olaf Scholz, is set to unveil a military strategy review on Wednesday aimed at making the Bundeswehr the leading conventional army in Europe. Despite receiving unprecedented financial resources, the institution has been slow to reform.",,,https://img.lemde.fr/2026/04/15/0/0/5000/3333/398/265/75/0/5af2069_ftp-1-vt2vs5d5vwyo-f471c3c114994fa4b6522737cde09356-1-c6ce95aa3c484e4583c9f62bdd334b19.jpg
Sealing the internet: How Putin wants to cut Russia off from the rest of the world,https://www.lemonde.fr/en/international/visuel/2026/04/22/sealing-the-internet-how-putin-wants-to-cut-russia-off-from-the-rest-of-the-world_6752723_4.html,Subscribers only,"Controlling information has become a matter of survival for the Russian leader. Since 2019, he has sought to create a 'sovereign RuNet' under his control and cut off from the world. The technical implementation of this project has accelerated since the start of the war in Ukraine in 2022.",,,https://img.lemde.fr/2026/04/15/0/181/3360/2240/398/265/75/0/e8359e5_upload-1-9l34ikskq94y-internet-russe-media-appel.png
"'I was so exhausted, I started hitting myself. They laughed': Four Cuban asylum seekers recount their ordeal at Europe's borders",https://www.lemonde.fr/en/international/article/2026/04/23/i-was-so-exhausted-i-started-hitting-myself-they-laughed-four-cuban-asylum-seekers-recount-their-ordeal-at-europe-s-borders_6752738_4.html,Subscribers only,"The European Court of Human Rights is expected to rule in the coming weeks on the pushbacks experienced by four Cubans at the border between Lithuania and Belarus, against the backdrop of a hybrid war with Russia.", Julia Pascual,Feature,https://img.lemde.fr/2026/04/19/300/0/4800/3200/664/442/75/0/ddb497e_upload-1-bifme87dsouh-00005-cubans-lithuania-02-03apr2026.jpg
US secretary of the Navy to leave office 'immediately',https://www.lemonde.fr/en/international/article/2026/04/23/us-secretary-of-the-navy-to-leave-office-immediately_6752731_4.html,,,,,https://img.lemde.fr/2026/04/22/0/0/6000/4000/198/132/95/0/db52e2e_ftp-1-yty7krp3hixe-2026-04-22t215859z-342135541-rc2yliagqyz2-rtrmadp-3-usa-trump-navy.JPG
Macron wants to apply 'Notre-Dame method' to 150 strategic industrial projects,https://www.lemonde.fr/en/economy/article/2026/04/23/macron-wants-to-apply-notre-dame-method-to-150-strategic-industrial-projects_6752744_19.html,Subscribers only,,,,https://img.lemde.fr/2026/04/22/0/0/8256/5504/198/132/95/0/3ac949f_ftp-1-fbkuqnhp9dhg-5836607-01-06.jpg
'The gas shock feared at the start of the war in Iran has not materialized',https://www.lemonde.fr/en/economy/article/2026/04/22/the-gas-shock-feared-at-the-start-of-the-war-in-iran-has-not-materialized_6752728_19.html,Subscribers only,,,,https://img.lemde.fr/2026/04/16/0/0/4000/2666/198/132/95/0/a4366b6_ftp-1-pa0xn2clndah-2026-04-16t193712z-1478968362-rc2f8fa9pz7a-rtrmadp-3-exxon-cargo-sales.JPG
Zelensky to join EU leaders in Cyprus after €90bn loan unblocked,https://www.lemonde.fr/en/international/article/2026/04/23/zelensky-to-join-eu-leaders-in-cyprus-after-90bn-loan-unblocked_6752741_4.html,,,,,https://img.lemde.fr/2026/04/16/0/0/5385/3590/198/132/95/0/fd09b21_ftp-1-ct3kw4e0di5f-5784386-01-06.jpg
Ukraine's military chaplains bear witness to the hell of the front lines: 'Everyone started to believe in God after the first bombing',https://www.lemonde.fr/en/international/article/2026/04/22/ukraine-s-military-chaplains-bear-witness-to-the-hell-of-the-front-lines-everyone-started-to-believe-in-god-after-the-first-bombing_6752724_4.html,Subscribers only,,,,
"Israeli strike kills Lebanese journalist, wounds another despite ceasefire",https://www.lemonde.fr/en/international/article/2026/04/23/israeli-strike-kills-lebanese-journalist-wounds-another-despite-ceasefire_6752736_4.html,,,,,
Japan lifts ban on lethal arms exports,https://www.lemonde.fr/en/international/article/2026/04/22/japan-lifts-ban-on-lethal-arms-exports_6752730_4.html,Subscribers only,,,,
The playful world of British painter Rose Wylie exhibited for the first time in France,https://www.lemonde.fr/en/m-le-mag/article/2026/04/23/the-playful-world-of-british-painter-rose-wylie-exhibited-for-the-first-time-in-france_6752735_117.html,Subscribers only,,,,
Second French peacekeeper dies after ambush blamed on Hezbollah,https://www.lemonde.fr/en/middle-east-crisis/article/2026/04/22/second-french-peacekeeper-dies-after-ambush-blamed-on-hezbollah_6752718_368.html,,,,,
Israeli films caught between calls for boycott and government threats,https://www.lemonde.fr/en/opinion/article/2026/04/21/israeli-films-caught-between-calls-for-boycott-and-government-threats_6752680_23.html,Subscribers only,,,,
University of Strasbourg moves to expel international students over unpaid tuition,https://www.lemonde.fr/en/campus/article/2026/04/22/university-of-strasbourg-moves-to-expel-international-students-over-unpaid-tuition_6752721_11.html,Subscribers only,,,,
French right-wing leader's call to ostracize Spain over migration policy sparks backlash,https://www.lemonde.fr/en/france/article/2026/04/22/french-right-wing-leader-s-call-to-ostracize-spain-over-migration-policy-sparks-backlash_6752719_7.html,Subscribers only,,,,
'Why am I alive?': The Yazidi genocide as told by one of its survivors,https://www.lemonde.fr/en/international/article/2026/04/21/why-am-i-alive-the-yazidi-genocide-as-told-by-one-of-its-survivors_6752681_4.html,Subscribers only,"Samih Taha, now a refugee in France, is one of the few survivors of the Islamic State group massacre of his village in northern Iraq on August 15, 2014. Then 17 years old, he went into debt to buy back his mother and sisters, who had been forced into sexual slavery. He told Le Monde his story and the tragedy that befell his family.", Soren Seelow,Long Read,https://img.lemde.fr/2026/04/17/1435/0/4724/3149/664/442/75/0/5abb215_upload-1-dxhhltamrl2z-vdsl9091-3-a-04-26.jpg
The Belgian PM's troubling ambivalence toward Russia,https://www.lemonde.fr/en/opinion/article/2026/04/22/belgian-pm-s-troubling-ambivalence-toward-russia_6752696_23.html,Subscribers only,"Bart De Wever faces criticism for his unclear stances on the level of support the European Union should provide to Ukraine. The Flemish nationalist has defended himself against accusations of playing into Moscow's hands, insisting that he only aims to push the 27 member states forward.", Jean-Pierre Stroobants,News analysis,https://img.lemde.fr/2026/03/19/0/0/3543/2362/664/442/75/0/51ef583_ftp-1-ioikb40nvy1f-c4e0c6bc32bc4205904fb7d3508cc329-0-5ef3aea6fe8c49fdb46a07783c69b16d.jpg
'Bookshops now serve as sentinels of resistance to the radical rightward shift of society',https://www.lemonde.fr/en/economy/article/2026/04/22/bollore-s-takeover-of-grasset-bookshops-now-serve-as-sentinels-of-resistance-to-the-radical-rightward-shift-of-society_6752706_19.html,Subscribers only,"Christian Thorel, a prominent figure in independent book selling, was among the first to sound the alarm about billionaire Vincent Bolloré's ideological grip on the publishing sector, starting with the acquisition of France's top publishing group Hachette, in 2023.", Ariane Chemin,Interview,https://img.lemde.fr/2026/04/21/0/0/5500/3666/664/442/75/0/329abc2_upload-1-syml47hl7azf-rea9026417.jpg
'Netanyahu is driving Israel further away from its European and American allies than ever before',https://www.lemonde.fr/en/opinion/article/2026/04/22/netanyahu-is-driving-israel-further-away-from-its-european-and-american-allies-than-ever-before_6752725_23.html,Subscribe,,,Column,https://img.lemde.fr/2022/03/18/0/0/0/0/100/100/60/0/bfe4dc9_1647595527633-f2df5fa-237.jpeg
The welcome voice of Pope Leo XIV,https://www.lemonde.fr/en/opinion/article/2026/04/20/the-welcome-voice-of-pope-leo-xiv_6752618_23.html,,,,Editorial,
"'Some French businesses are willing to associate with the Rassemblement National, which harbors a deep mistrust of labor unions'",https://www.lemonde.fr/en/opinion/article/2026/04/21/some-french-businesses-are-willing-to-associate-with-the-rassemblement-national-which-harbors-a-deep-mistrust-of-labor-unions_6752647_23.html,Subscribe,,,Column,https://img.lemde.fr/2023/07/06/0/0/0/0/100/100/60/0/bee4e6c_1688634540522-73f3cca-40.jpg
