headline,link,premium,subhead,byline,article_type,image
 Revealed: Satellite image shows mysterious cargo at Iranian nuclear site in 2025  ,https://www.lemonde.fr/en/international/article/2026/03/28/revealed-satellite-image-shows-mysterious-cargo-at-iranian-nuclear-site-in-2025_6751890_4.html,Subscribers only,"Le Monde reveals an image of a convoy at the gates of a major underground nuclear complex in Iran. According to several experts, it could be part of the country's stockpile of enriched uranium.",,,https://img.lemde.fr/2026/03/27/43/0/1024/682/400/266/75/0/b653340_upload-1-e4ftvk4xfx7t-image-d-appel-de-tete.jpg
Israel army reports war's first missile attack from Yemen,https://www.lemonde.fr/en/international/article/2026/03/28/israel-army-reports-war-s-first-missile-attack-from-yemen_6751891_4.html,,,,,https://img.lemde.fr/2026/03/27/0/0/6720/4480/398/265/75/0/cfd482c_ftp-1-zxmvwsy62ppm-5607557-01-06.jpg
Behind the scenes of the pope's unexpected visit to Monaco,https://www.lemonde.fr/en/france/article/2026/03/28/behind-the-scenes-of-the-pope-s-unexpected-visit-to-monaco_6751889_7.html,Subscribers only,,,,https://img.lemde.fr/2026/03/25/0/0/5446/3630/398/265/75/0/4ab62dd_ftp-1-v34tamlky96n-2026-03-25t112321z-685162503-rc2nbkamwecz-rtrmadp-3-pope-audience.JPG
US envoy hopeful on Iran talks as strikes target nuclear facilities,https://www.lemonde.fr/en/international/article/2026/03/28/us-envoy-hopeful-on-iran-talks-as-strikes-target-nuclear-facilities_6751883_4.html,,"'We think there will be meetings this week, we're certainly hopeful for it,' Steve Witkoff told a business forum in Miami on Friday, as US-Israeli strikes hit two of Iran's nuclear sites. Meanwhile, Secretary of State Marco Rubio said he had won G7 support to oppose Iran's attempts to impose a toll on Strait of Hormuz shipping.",,,https://img.lemde.fr/2026/03/26/11/0/5900/3933/398/265/75/0/15199c8_ftp-1-a3gf7skexfjn-2026-03-26t151810z-1928883998-rc2fckay8awn-rtrmadp-3-usa-trump.JPG
Singer Gims charged with 'aggravated money laundering',https://www.lemonde.fr/en/france/article/2026/03/28/singer-gims-charged-with-aggravated-money-laundering_6751887_7.html,Subscribers only,The artist was held in police custody at the judicial customs authorities on Wednesday as part of an ongoing investigation into a vast international money laundering case.,,,https://img.lemde.fr/2026/03/27/0/0/6000/4000/398/265/75/0/a96413d_ftp-1-r0ejkjnxchfk-5605315-01-06.jpg
"EU is targeting small parcels from Shein, Temu and other Chinese e-commerce sites",https://www.lemonde.fr/en/economy/article/2026/03/28/eu-is-targeting-small-parcels-from-shein-temu-and-other-chinese-e-commerce-sites_6751885_19.html,Subscribers only,Non-European platforms will now be legally responsible for products entering the European Union and will be taxed starting in July.,,,https://img.lemde.fr/2026/03/26/0/0/5338/3558/398/265/75/0/b2acbdf_upload-1-pv5abpxp32nx-000-83tr7t3.jpg
"Matisse, the carver of light, at the Grand Palais in Paris",https://www.lemonde.fr/en/culture/article/2026/03/28/matisse-the-carver-of-light-at-the-grand-palais-in-paris_6751886_30.html,Subscribers only,The delightful exhibition showcases later work by the artist who never stopped experimenting and features his famous cut-outs as well as monumental canvases., Harry Bellet,Review,https://img.lemde.fr/2026/03/20/703/0/5108/3405/664/442/75/0/9c31e5a_upload-1-ollnvormjupl-014-l-escargot.jpg
Bank of America agrees to pay $72 million to settle Epstein sex-trafficking suit,https://www.lemonde.fr/en/international/article/2026/03/28/bank-of-america-agrees-to-pay-72-million-to-settle-epstein-sex-trafficking-suit_6751888_4.html,,,,,https://img.lemde.fr/2026/03/27/0/0/3619/2413/198/132/95/0/a37c733_ftp-1-48rsyuxjdkvc-2026-03-27t160831z-884847769-rc23dka0aaie-rtrmadp-3-people-jeffrey-epstein-bofaml.JPG
G7 foreign ministers demand 'immediate' end to attacks against civilians in Middle East war,https://www.lemonde.fr/en/international/article/2026/03/27/g7-foreign-ministers-demand-end-to-attacks-against-civilians-in-middle-east-war_6751875_4.html,,,,,https://img.lemde.fr/2026/03/27/0/0/6000/4000/198/132/95/0/f28f351_ftp-1-jiwhvsdpob69-1c3ff2e64671478798ba67e738dcd846-0-0489291ed06043cd877dd5306f8a6478.jpg
Volodymyr Zelensky's exclusive interview with Le Monde on the war in Ukraine,https://www.lemonde.fr/en/international/video/2026/03/27/volodymyr-zelensky-s-exclusive-interview-with-le-monde-on-the-war-in-ukraine_6751879_4.html,Subscribers only,,,,https://img.lemde.fr/2026/03/25/1442/0/4042/2695/198/132/95/0/18b8873_upload-1-yangnjbej6mc-zelensky-rajh-4.jpg
Tiger Woods arrested on suspicion of DUI after Florida crash,https://www.lemonde.fr/en/international/article/2026/03/27/tiger-woods-arrested-charged-with-dui-after-florida-crash_6751882_4.html,,,,,https://img.lemde.fr/2026/03/27/0/0/3737/2491/198/132/95/0/66ddf0e_ftp-1-rrqfltfag9ta-7e5e2c023c014da1a761b94b74d42af6-0-af0be0eedde94670a9e16d3dc0365df4.jpg
UN chief launches task force to aid passage of fertilizer through Hormuz Strait,https://www.lemonde.fr/en/international/article/2026/03/27/un-chief-launches-task-force-to-aid-passage-of-fertilizer-through-hormuz-strait_6751881_4.html,,,,,
El-Daein Hospital in Darfur was deliberately struck by Sudanese army,https://www.lemonde.fr/en/le-monde-africa/article/2026/03/27/el-daein-hospital-in-darfur-was-deliberately-struck-by-sudanese-army_6751874_124.html,Subscribers only,,,,
War in Iran: Israel and Gulf states fear a hasty US exit,https://www.lemonde.fr/en/international/article/2026/03/28/war-in-iran-israel-and-gulf-states-fear-a-hasty-us-exit_6751884_4.html,Subscribers only,,,,
ICC member states divided over prosecutor Karim Khan's fate,https://www.lemonde.fr/en/international/article/2026/03/27/icc-member-states-divided-over-prosecutor-karim-khan-s-fate_6751873_4.html,Subscribers only,,,,
Israeli army warns of insufficient manpower,https://www.lemonde.fr/en/international/article/2026/03/27/israeli-army-warns-of-insufficient-manpower_6751872_4.html,Subscribers only,,,,
Epstein victims sue US government and Google over revealed identities,https://www.lemonde.fr/en/international/article/2026/03/27/epstein-victims-sue-us-government-and-google-over-revealed-identities_6751867_4.html,,,,,
Chair of the NATO Military Committee: 'European nations step in for the United States whenever they are drawn to another front',https://www.lemonde.fr/en/international/article/2026/03/27/chair-of-the-nato-military-committee-european-nations-step-in-for-the-united-states-whenever-they-are-drawn-to-another-front_6751877_4.html,Subscribers only,,,,
"Cybercrime, the blind spot in museum security",https://www.lemonde.fr/en/culture/article/2026/03/27/cybercrime-the-blind-spot-in-museum-security_6751854_30.html,Subscribers only,,,,
"In Nabatieh, southern Lebanon, 'no one ventures outside anymore apart from rescue teams'",https://www.lemonde.fr/en/international/article/2026/03/27/in-nabatieh-southern-lebanon-no-one-ventures-outside-anymore-apart-from-rescue-teams_6751853_4.html,Subscribers only,"Like 42 other rescue workers since the war began on March 2, 16-year-old Joude Souleiman was killed by an Israeli drone strike in Nabatieh, the second-largest Shiite city in southern Lebanon, where only a few hundred people out of 75,000 residents remain.", Madjid Zerrouky,Feature,https://img.lemde.fr/2026/03/26/305/0/7280/4853/664/442/75/0/e96d0f1_upload-1-2amrlevs62fr-raf-liban-nabatieh-018.JPG
The US and Israel are fighting different wars against the same foe,https://www.lemonde.fr/en/international/article/2026/03/27/united-states-and-israel-are-facing-the-same-iranian-foe-but-are-fighting-different-wars_6751849_4.html,Subscribers only,"Donald Trump and Benjamin Netanyahu share many objectives. However, their respective public opinions and electoral interests may ultimately highlight significant differences between the two leaders.", Gilles Paris,News analysis,https://img.lemde.fr/2026/03/23/0/0/6000/4000/664/442/75/0/229139f_ftp-1-3blbcrwhuh70-2026-03-23t143832z-1631909401-rc2bakahfmj6-rtrmadp-3-iran-crisis-aftermath.JPG
"From afar, American students in France feel the shockwaves of Trump",https://www.lemonde.fr/en/campus/article/2026/03/24/from-afar-american-students-in-france-feel-the-shockwaves-of-trump_6751786_11.html,Subscribers only,"As academic freedom declines in the US, some young people are choosing France to pursue master's and doctoral degrees. Yet, between delayed scholarships, intrusive questions and stereotypes, their experience remains shaken by the latest developments in their country.", Audrey Parmentier,In Depth,https://img.lemde.fr/2026/03/20/25/0/2138/1425/664/442/75/0/d7008d2_upload-1-ptiu7nespa2z-campus-25-mars-copie.jpg
Courts finally recognize dangers of social media,https://www.lemonde.fr/en/opinion/article/2026/03/27/courts-finally-recognize-dangers-of-social-media_6751866_23.html,,,,Editorial,
"'In Paris, the ideal of urban transformation clearly resonated with voters'",https://www.lemonde.fr/en/opinion/article/2026/03/25/in-paris-the-ideal-of-urban-transformation-clearly-resonated-with-voters_6751810_23.html,Subscribe,,,Op-Ed,
The French people's vote is still up for grabs,https://www.lemonde.fr/en/opinion/article/2026/03/23/the-french-people-s-vote-is-still-up-for-grabs_6751740_23.html,,,,Editorial,
